<?xml version="1.0" encoding="UTF-8"?>
<books xmlns="http://www.it-academy.by/books_schema"
	xmlns:xsi="http://www.w3.org/2001/XMLSchema-instance"
	xsi:schemaLocation="http://www.it-academy.by/books_schema books_schema.xsd">

	
	<book id="1">
		<title>Book1</title>
		<pages>345</pages>
		<author>
			<name>Viktor</name>
			<surname>Ivanov</surname>
			<date>1987-04-21</date>
		</author>
		
	</book>
	<book id="2">
		<title>Book2</title>
		<pages>218</pages>
		<author>
			<name>Petr</name>
			<surname>Petrov</surname>
			<date>1997-01-01</date>
		</author>
	</book>
</books>